{
  "schema_version": "2.0.0",
  "artifact_type": "information_source",
  "source_id": "SRC-000150",
  "notion_url": "https://app.notion.com/p/3e9e5855be39818bb165e7b754bc3ab4",
  "title": "とよはしネイチャースポット保全マニュアル－嵩山蛇穴・浅間神社周辺",
  "source_type": "Web Page",
  "journal_or_publisher": "豊橋市",
  "authors": null,
  "year": null,
  "url": "https://www.city.toyohashi.lg.jp/4420.htm",
  "doi": null,
  "version_or_edition": null,
  "reliability_note": "豊橋市公式。姫街道・嵩山宿、国史跡の洞穴、大蛇伝説の由来の確認に使用。"
}
