{
  "schema_version": "2.0.0",
  "artifact_type": "information_source",
  "source_id": "SRC-0101",
  "notion_url": "https://app.notion.com/p/3e3e5855be3981feb696c54d4394ad37",
  "title": "玉川上水の歴史",
  "source_type": "Web Page",
  "journal_or_publisher": "東京都水道局",
  "authors": "東京都水道局",
  "year": null,
  "url": "https://www.waterworks.metro.tokyo.lg.jp/kouhou/pr/tamagawa/rekishishiritai/rekishi",
  "doi": null,
  "version_or_edition": null,
  "reliability_note": "東京都水道局による玉川上水の公式歴史解説。1893年の三多摩東京府編入と玉川上水の一元管理、近代水道への転換を確認するために用いる。後世の制度史整理であり同時代一次史料ではない。"
}
